{
  "shape": "rect",
  "diameter": 10,
  "angle": 0,
  "circular_bolts": 5,
  "s_c": 5,
  "s_r": 5,
  "x_bolts": 2,
  "y_bolts": 3,
  "bolts_table": [
    {
      "x": 0,
      "y": 0
    }
  ],
  "L_eh": 2,
  "L_ev": 2,
  "plate_width": 20,
  "plate_height": 20,
  "t": 1,
  "bolt_size": 0.25,
  "grade": "A307",
  "f_ub": 30,
  "shear_plane": "thread",
  "bolt_type": "bearing",
  "faying_surface": "A",
  "n_s": 1,
  "n_fillers": 1,
  "plate_grade": "A36",
  "f_y": 50,
  "f_u": 65,
  "grip_length": 2,
  "treatment": "painted",
  "exposure": "exposed",
  "hole": "normal",
  "clearance": 0.0625,
  "d_h": 20,
  "d_l": 20,
  "hole_deformation": "considered",
  "design_method": "asd",
  "analysis": "elastic",
  "end_loading": "non-end",
  "plate_connection_type": "one",
  "prying_method": "vertical",
  "prying_factor": 1.1,
  "stub_thickness": 1,
  "Fx": 1,
  "Fy": 0,
  "Fz": 0,
  "Mx": 1,
  "My": 0,
  "Mz": 1,
  "graph_on": "hide",
  "uid": "6012-us-bolt-group-analysis",
  "current_unit_system": "metric",
  "project_details": {
    "project_company": "",
    "project_name": "",
    "project_designer": "",
    "project_id": "",
    "project_client": "",
    "project_notes": ""
  }
}